商品名,価格,url,説明文,Jancode
【すとぷり あにまるるーむわんぴーす ころん】すとろべりーぷりんす マフラー,11998,https://item.rakuten.co.jp/saitamatoy/hyt2022020815/,,
すとろべりーらぶっ！ (初回限定盤 CD＋DVD) [ すとぷり ],3061,https://item.rakuten.co.jp/book/15902840/,"すとぷりBKSCPN_【newcd】 ストロベリーラブッ ストプリ 発売日：2019年07月03日 予約締切日：2019年06月30日 STRAWBERRY LOVE! JAN：4988031338599 STPRー9001 STPR Records 初回限定 STPR Records 【CD】, 収録曲未定（通常盤、初回限定盤共通） 【DVD】 幕張メッセで開催された“すとろべりーめもりーvol.7”のライブ映像を抜粋して収録。 CD JーPOP ポップス DVD・ブルーレイ付",4988031338599
Strawberry Prince (初回限定盤 CD＋DVD) [ すとぷり ],2784,https://item.rakuten.co.jp/book/16464058/,すとぷりBKSCPN_【newcd】 ストロベリー プリンス シリツストプリガクエン ガクリョクテストヘン ストプリ 発売日：2020年11月11日 予約締切日：2020年11月07日 STRAWBERRY PRINCE SHIRITSU SUTOPURI GAKUEN ーGAKURYOKU TEST HENー JAN：4988031402825 STPRー9020 STPR Records 初回限定 STPR Records [Disc1] 『Strawberry Prince』／CD アーティスト：すとぷり [Disc2] 『Strawberry Prince』／DVD アーティスト：すとぷり CD JーPOP ポップス DVD・ブルーレイ付,4988031402825
すとろべりーねくすとっ！(初回限定ボイスドラマCD盤 2CD) [ すとぷり ],3066,https://item.rakuten.co.jp/book/16137917/,すとぷりBKSCPN_【newcd】 ストロベリーネクストッ ストプリ 発売日：2020年01月15日 予約締切日：2020年01月11日 STRAWBERRY NEXT! JAN：4988031369012 STPRー9012/3 STPR Records 初回限定 STPR Records CD JーPOP ポップス,4988031369012
【現品限り】莉犬めもりー りいぬめもりー りいぬ すとぷり ファンブック ななもり【メール便を選択の場合送料無料】,2200,https://item.rakuten.co.jp/ablemart/9784845636259/,"***ご注意***こちらの【現品限り】の商品は、版元品切・絶版などで入手が困難な希少品となっております。未使用商品ではありますが、中には経年劣化による色あせ、擦れ跡等がみられる商品もございますので恐れ入りますが予めご了承いただけると幸いでございます。（個別の商品の状態につきましては、お気軽にお問い合わせください）莉犬×ななもり。著メーカー:STPR,BOOKSISBN:9784845636259B5変 厚さ0.9cm商品説明'SNSフォローワー累計500万人超え！YouTube、ツイキャス 、TikTokなど、ネットを中心に活動している「莉犬」初の公式ファンブックが登場！エンタメユニット「すとぷり」に入るまでの出来事や、これからのこと、そしてリスナーさんへの想いなど、莉犬のすべてを詰め込んだ一冊！本誌のための貴重な撮り下ろしや、これまでのイラスト紹介に加え、ゴールドディスクとなった1stフルアルバム「タイムカプセル」収録曲についての本人コメントなど、全112ページに渡ってお届けします。'著者について '著者についてななもり。（企画・プロデュース）YouTubeやツイキャス、TikTok等、ネットを中心に活動している6人組エンタメユニット「すとぷり」のリーダー。活動の総合プロデュースを手掛けている。莉犬「すとぷり」のメンバーで赤色担当。自身のSNSフォロワー累計500万人を突破！,1stフルアルバム『タイムカプセル』は、Billboardの週間アルバム・セールス・チャートで1位、ゴールドディスクに認定された。「歌ってみた」動画では、2，000万再生を超える作品も。声優としても活躍中。'目次 '【CONTENT】PREFACE■CHAPTER 01,PROFILEPROFILE莉犬くんの Answer ─ 4Step 質問コーナー大事な FAMILY 莉犬くんのお部屋莉犬くんの 1 日SNAP PHOTORinu After School ─ シルエットグラビアHISTORY莉犬くんの歴史■CHAPTER 02,SINGERSONG LISTシングル・アルバム楽曲紹介作詞楽曲リスト─ 歌詞とコメントLIVE LISTワンマンライブを振り返るLIVE GOODS LISTワンマンライブのグッズ紹介■CHAPTER 03,CHARACTERGALLERYいろんな莉犬くんを紹介FRIENDS動画に登場する仲間たちGOODS COLLECTION莉犬くんのグッズフォトグラフ■CHAPTER 04,MESSAGEりすなーさんに向けてのメッセージ'",9784845636259
すとろべりーねくすとっ！(初回限定ライブ映像盤B CD＋DVD) [ すとぷり ],2894,https://item.rakuten.co.jp/book/16137916/,すとぷりBKSCPN_【newcd】 ストロベリーネクストッ ストプリ 発売日：2020年01月15日 予約締切日：2020年01月11日 STRAWBERRY NEXT! JAN：4988031369005 STPRー9011 STPR Records 初回限定 STPR Records [Disc1] 『すとろべりーねくすとっ!』／CD アーティスト：すとぷり [Disc2] 『すとろべりーねくすとっ!』／DVD アーティスト：すとぷり CD JーPOP ポップス DVD・ブルーレイ付,4988031369005
【中古】Strawberry　Prince　別冊！すとめもぶっく！（アルバムスペシャルVer．！！）　［トレカ付属なし］/ すとぷり,898,https://item.rakuten.co.jp/renet3/0013176068/,"&nbsp;&nbsp;&nbsp; Strawberry,Prince,別冊！すとめもぶっく！（アルバムスペシャルVer．！！）,［トレカ付属なし］ の詳細 付属品: 冊子付 発売元: STPR,Records アーティスト名: すとぷり カナ: ストロベリープリンスベッサツスメトモブックアルバムスペシャルヴァージョン / ストプリ ディスク枚数: 1枚 品番: STPR9019 発売日: 2020/11/11 曲名Disc-11.,Streamer（ツイキャス2020夏キャンペーンテーマソング）2.,スキスキ星人3.,Very4.,大宇宙ランデブー（TVアニメ「妖怪学園Y〜Nとの遭遇〜」オープニングテーマ／ゲーム「妖怪学園Y〜ワイワイ学園生活〜」エンディングテーマ）5.,ストロベリー・レボリューション6.,STRIKE,the,PRISON！！7.,ドラマチックのアンチ8.,Night,of,Fantastic9.,じゃむじゃむシグナル10.,マブシガリヤ11.,四季12.,エンキョリクライ。13.,チェキラ☆14.,レベリング15.,Trick,or,Prince16.,スピール17.,向こうへ（荒野行動3周年テーマソング）18.,ハジメテキミと19.,Feel,Free！20.,Prince 関連商品リンク : すとぷり STPR,Records",
Strawberry Prince [ すとぷり ],2411,https://item.rakuten.co.jp/book/16464057/,すとぷりBKSCPN_【newcd】 ストロベリー プリンス ストプリ 発売日：2020年11月11日 予約締切日：2020年11月07日 STRAWBERRY PRINCE JAN：4988031402832 STPRー1009 STPR Records STPR Records [Disc1] 『Strawberry Prince』／CD アーティスト：すとぷり CD JーPOP ポップス,4988031402832
すとろべりーすたーと [ すとぷり ],1736,https://item.rakuten.co.jp/book/16137919/,すとぷりBKSCPN_【newcd】 ストロベリースタート ストプリ 発売日：2020年01月15日 予約締切日：2020年01月11日 STRAWBERRY START JAN：4988031369036 STPRー1007 STPR Records STPR Records [Disc1] 『すとろべりーすたーと』／CD アーティスト：すとぷり CD JーPOP ポップス,4988031369036
すとろべりーねくすとっ！(初回限定ライブ映像盤A CD＋DVD) [ すとぷり ],2894,https://item.rakuten.co.jp/book/16137915/,すとぷりBKSCPN_【newcd】 ストロベリーネクストッ ストプリ 発売日：2020年01月15日 予約締切日：2020年01月11日 STRAWBERRY NEXT! JAN：4988031368992 STPRー9010 STPR Records 初回限定 STPR Records [Disc1] 『すとろべりーねくすとっ!』／CD アーティスト：すとぷり [Disc2] 『すとろべりーねくすとっ!』／DVD アーティスト：すとぷり CD JーPOP ポップス DVD・ブルーレイ付,4988031368992
すとぷり 2021 Spring オフィシャルグッズ すとぷり あにまるますこっと ジェル すとろべりーぷりんす アニマル マスコット ぬいぐるみ,3460,https://item.rakuten.co.jp/yamamoridou/0649-011852/,商品情報 商品の説明 すとぷり 2021 Spring オフィシャルグッズ すとぷり あにまるますこっと（ジェル） 主な仕様 【サイズ】 W6cm×H10.2cm（約） 【素材】 本体：ポリエステル、綿 ボールチェーン：鉄,
すとろべりーねくすとっ！(通常盤) [ すとぷり ],2411,https://item.rakuten.co.jp/book/16137918/,すとぷりBKSCPN_【newcd】 ストロベリーネクストッ ストプリ 発売日：2020年01月15日 予約締切日：2020年01月11日 STRAWBERRY NEXT! JAN：4988031369029 STPRー1006 STPR Records STPR Records [Disc1] 『すとろべりーねくすとっ!』／CD アーティスト：すとぷり CD JーPOP ポップス,4988031369029
すとぷり すとろべりーめもりーvol. Next!! 公式グッズ アクリルキーホルダー 莉犬 B,2309,https://item.rakuten.co.jp/tokumaru2019/4917900752561/,◆商品名：すとぷり すとろべりーめもりーvol. Next!! 公式グッズ アクリルキーホルダー 莉犬 B 全長：約6.5cm すとぷり すとろべりーめもりーvol.Next!! 公式グッズ アクリルキーホルダー 莉犬 B,
ジェルめもりー ジェル ジェルくん すとぷり ファンブック 本【メール便を選択の場合送料無料】,2200,https://item.rakuten.co.jp/ablemart/9784845637621/,メーカー:STPR BOOKSISBN:9784845637621B5変 112ページSNSフォロワー累計670万人を突破!自身で企画、脚本、音声編集、さらに登場する全キャラクターのアフレコまで担当する「遠井さん」シリーズが話題!「すとぷり」の最強エンターテイナー「ジェル」初の公式ファンブックが発売決定!動画配信を始めたキッカケや、「すとぷり」に加入し、多くの活動に挑戦していく中で感じたこと、リスナーさんへの想いなど、'ジェル'の'これまで'と'これから'をすべて詰め込んだ一冊になっております。本誌のための貴重な撮り下ろしフォトや、これまでのイラスト紹介など、全112ページに渡ってお届けします。,9784845637621
すとぷり すとめも10 すとろべりーぷりんす すとろべりーめもりーVol.10 公式グッズ ペンライト vol.3,11953,https://item.rakuten.co.jp/tokumaru2019/4917900752557/,◆商品名：すとぷり すとめも10 すとろべりーぷりんす すとろべりーめもりーVol.10 公式グッズ ペンライト vol.3 使用電池：単4×3 対象年齢：12歳以上 新品未使用品です。すとめも10限定商品。,
【送料無料】 すとぷり / すとろべりーらぶっ! 【初回限定盤】 【CD】,2970,https://item.rakuten.co.jp/hmvjapan/9824006/,"基本情報ジャンルジャパニーズポップスフォーマットCDレーベルStpr Records発売日2019年07月03日商品番号STPR-9001発売国日本組み枚数2関連キーワード ストプリ ストロベリーラブッ 4988031338599 【FS_708-2】出荷目安の詳細はこちら＞＞楽天市場内検索 『在庫あり』表記について商品説明すとぷりファーストフルアルバム「すとろべりーらぶっ!」発売!動画総再生数は4億3000万回超え(※2019/4/25時点) 2018年12月24日に両国国技館で行われたライブは、チケットが即完。この驚異的な数字を叩き出しているのが、すとぷり。中高生のあいだで絶大なる支持を得ているエンタメユニット。2016年6月に、ニコニコ動画の歌い手やツイキャスの配信者、ゲーム実況者より結成され、莉犬、さとみ、ころん、ジェル、るぅと、ななもり。の6人で活動中。そんなすとぷりのファーストフルアルバムが登場!初回限定盤は、CDに加えて、幕張メッセで開催された“すとろべりーめもりーvol.7”のライブ映像 を抜粋して収録。(メーカー・インフォメーションより)曲目リストディスク11.GO GO CRAZY/2.Move on!/3.僕らだけのシャングリラ/4.アニバーサリー/5.キングオブ受動態/6.道標/7.好きになっていいよね?/8.よさこいディスコParty/9.Don't Give Up!!/10.BREAK OUT/11.Day By Day/12.No Perfect/13.朝の夕陽/14.おかえりらぶっ!ディスク21.AquaKiss/2.はりーはりーらぶ/3.大好きになればいいんじゃない?その他のバージョンCD,,すとぷり / すとろべりーらぶっ!,,国内盤CD,,すとぷり / 【中古: 盤質A】 すとろべりーらぶっ!,,国内盤",4988031338599
【送料無料】 すとぷり / すとろべりーねくすとっ! 【初回限定ライブ映像盤A】(CD+DVD) 【CD】,2970,https://item.rakuten.co.jp/hmvjapan/10427997/,"基本情報ジャンルジャパニーズポップスフォーマットCDレーベルStpr Records発売日2020年01月15日商品番号STPR-9010発売国日本組み枚数1その他DVD付き, 初回限定盤関連キーワード ストプリ ストロベリーネクスト 4988031368992 【FS_708-2】出荷目安の詳細はこちら＞＞楽天市場内検索 『在庫あり』表記について商品説明いちごの日＝1月15日にセカンドフルアルバム「すとろべりーねくすとっ!」発売!!2019年7月3日に発売された1stフルアルバム「すとろべりーらぶっ!」がオリコン週間アルバムランキング1位を飾った＜すとぷり＞のセカンドフルアルバムが、いちごの日にリリース! 2020年3月はナゴヤドームでのワンマンも決定しており、今年もから目が離せないっ!制作陣には、HoneyWorksや、ナユタン星人、DECO*27、れるりり,も起用。12月27日放送開始の妖怪ウォッチ新シリーズ＜妖怪学園Y〜Nとの遭遇〜＞オープニングテーマ「ギンギラ銀河」も収録される。初回限定ライブ映像盤Aには、2019年9月に実施されたメットライフドームでのワンマンライブから選りすぐりの大人組ライブ映像1曲を含む全3曲を収録。(メーカー・インフォメーションより)曲目リストディスク11.ストロベリー☆プラネット!YouTube/2.ギンギラ銀河/3.アモーレ・ミオ/4.Next Stage!!/5.Now and Forever/6.Party Light/7.忍恋 (ななもり。×ジェル)/8.溶解ウォッチ (莉犬×るぅと)/9.遊獣浮男ボーイ (さとみ×ころん)/10.脳内ピエロ (ななもり。×ジェル×さとみ)/11.咲かせて恋の1・2・3! (莉犬×るぅと×ころん)/12.ヒカリユメ/13.LOOK UP/14.タラレバ/15.好きでいてくれていいよ/16.革命前夜ディスク21.GO GO CRAZY/2.Move on!/3.キングオブ受動態/4.すとろべりーめもりーvol.10 ダイジェストその他のバージョンCD,,すとぷり / すとろべりーねくすとっ! 【初回限定ライブ映像盤B】(CD+DVD),,国内盤CD,,すとぷり / すとろべりーねくすとっ! 【初回限定ボイスドラマCD盤】(2CD),,国内盤CD,,すとぷり / すとろべりーねくすとっ!,,国内盤",4988031368992
すとぷり ペンケース 筆箱 ペンポーチ 大容量 ペンバッグ ツールバッグ 部品袋 化粧品バッグ 化粧ポーチ 高校生 男子 女子 おしゃれ かわいい 大容量 収納 小物入れ 中学生 小学生,3153,https://item.rakuten.co.jp/recolte-shop/n2fiotmznm/,【材質説明】牛津布（ポリエステル）【アクセサリー構造】2つのファスナーのメインポケット、1つのメインポケットにはポケットがありません。もう一つのメインポケットには3つのポケットと5つのペンスペースがあります。【製品性能】丈夫で耐摩耗性があり、バッグがしっかりとしています。ファスナーの動きがスムーズで、筆記用具、美術品など日常の必需品が収納できます。【適用シーン】体積が小さく、学校、事務室、旅行や化粧などの小物を日常的に収納するのに適しています。【洗濯説明】手洗いをおすすめします。容量が適当であれば、鉛筆のカバンにしてもいいし、小物のカバンにしてもいいし、女性用の化粧品のカバンにしてもいいです。,
すとぷり グッズ すとぷりマフラータオルっ 2020年夏ver.,3798,https://item.rakuten.co.jp/ikedashop/4920704050527/,◆商品名：すとぷり グッズ すとぷりマフラータオルっ 2020年夏ver. 2020 Summer オフィシャルグッズ 【サイズ】 W110cm×H20cm（約） 【素材】 綿100％,
すとぷり / すとろべりーすたーと [CD],1628,https://item.rakuten.co.jp/guruguru2/stpr-1007/,"CD発売日2020/1/15詳しい納期他、ご注文時はご利用案内・返品のページをご確認くださいジャンル邦楽J-POP,アーティストすとぷり収録時間組枚数1商品説明すとぷり / すとろべりーすたーとSTRAWBERRY START2019年3月に販路限定で発売された、記念すべき＜すとぷり＞のファーストミニアルバム「すとろべりーすたーと」を全国流通盤として再発売（同人CDのリメイク仕様）オリジナル発売日：2019年3月関連キーワードすとぷり 関連商品すとぷり CD商品スペック 種別 CD JAN 4988031369036 製作年 2019 販売元 ユニバーサル ミュージック登録日2019/11/18",4988031369036
【限定グッズ】 すとぷりくりすます すとぷり ノート すとろべりーぷりんす,2980,https://item.rakuten.co.jp/2bv-direct/4926502268472/,◆商品名：【限定グッズ】 すとぷりくりすます すとぷり ノート すとろべりーぷりんす すとぷりくりすます ！限定グッズの、すとぷりノート1冊 すとぷり すとぷりくりすます！ すとぷりノート！ ヴィレッジヴァンガード クリスマス 限定グッズ,
すとぷり すとろべりーめもりーvol. Next!! 公式グッズ アクリルキーホルダー るぅと A,1874,https://item.rakuten.co.jp/tokumaru2019/4917900752567/,◆商品名：すとぷり すとろべりーめもりーvol. Next!! 公式グッズ アクリルキーホルダー るぅと A 全長：約6.5cm すとぷり すとろべりーめもりーvol.Next!! 公式グッズ アクリルキーホルダー るぅと A,
ころんめもりー ころん ころんくん すとぷり ファンブック 本【メール便を選択の場合送料無料】,2200,https://item.rakuten.co.jp/ablemart/9784845637614/,メーカー:STPR BOOKSISBN:97848456376142021年、最も多くツイートされたゲームのコンテンツクリエイター世界1位！SNSフォローワー累計440万人超え!YouTube、ツイキャス 、TikTokなど、ネットを中心に活動している「ころん」初の公式ファンブックが登場!エンタメユニット「すとぷり」に入るまでの出来事や、活動について、リスナーさんへの想いなど、今のころんをすべて詰め込んだ一冊!本誌のための貴重な撮り下ろしや、過去のイラスト紹介など、全112ページに渡ってお届けします。著者についてころんすとぷりの水色担当！YouTubeではハイテンションでプレイするおもしろゲーム実況動画を毎日投稿中！2021年1月に発売した1stフルアルバム『アスター』がオリコン週間アルバムランキング、Billboard週間アルバム・セールス・チャートで1位！バーチャルモデルのお披露目配信では「#ころん3D」のハッシュタグが世界トレンド1位になるほか、Twitterによる2021年「世界でもっとも話題になったゲーム関連の人物」でも堂々の1位に輝くなど注目を集めています。,9784845637614
すとろべりーらぶっ！ [ すとぷり ],2750,https://item.rakuten.co.jp/book/15902841/,すとぷりBKSCPN_【newcd】 ストロベリーラブッ ストプリ 発売日：2019年07月03日 予約締切日：2019年06月30日 STRAWBERRY LOVE! JAN：4988031338605 STPRー1001 STPR Records STPR Records 収録曲未定（通常盤、初回限定盤共通） CD JーPOP ポップス,4988031338605
すとぷり ペンケース 筆箱 ペンポーチ 大容量 ペンバッグ ツールバッグ 部品袋 化粧品バッグ 化粧ポーチ 高校生 男子 女子 おしゃれ,2988,https://item.rakuten.co.jp/bv-direct/4919715287828/,◆商品名：すとぷり ペンケース 筆箱 ペンポーチ 大容量 ペンバッグ ツールバッグ 部品袋 化粧品バッグ 化粧ポーチ 高校生 男子 女子 おしゃれ かわいい 大容量 収納 小物入れ 中学生 小学生 【材質説明】牛津布（ポリエステル） 【アクセサリー構造】2つのファスナーのメインポケット、1つのメインポケットにはポケットがありません。もう一つのメインポケットには3つのポケットと5つのペンスペースがあります。 【製品性能】丈夫で耐摩耗性があり、バッグがしっかりとしています。ファスナーの動きがスムーズで、筆記用具、美術品など日常の必需品が収納できます。 【適用シーン】体積が小さく、学校、事務室、旅行や化粧などの小物を日常的に収納するのに適しています。 【洗濯説明】手洗いをおすすめします。 容量が適当であれば、鉛筆のカバンにしてもいいし、小物のカバンにしてもいいし、女性用の化粧品のカバンにしてもいいです。,
すとぷり 2021 Spring オフィシャルグッズ すとぷり あにまるますこっと ころん すとろべりーぷりんす アニマル マスコット ぬいぐるみ,3570,https://item.rakuten.co.jp/yamamoridou/0649-011851/,商品情報 商品の説明 すとぷり 2021 Spring オフィシャルグッズ すとぷり あにまるますこっと（ころん） 主な仕様 【サイズ】 W6cm×H10.2cm（約）,
【中古】 Strawberry　Prince【初回限定DVD盤】私立すとぷり学園　学力テスト編（DVD付）／すとぷり 【中古】afb,1573,https://item.rakuten.co.jp/bookoffonline/0019522115/,"すとぷり販売会社/発売会社：STPR,Records(STPR,Records)発売年月日：2020/11/11JAN：4988031402825動画総再生数23億回(※メンバーのYouTube公式チャンネルを含む総再生数)を突破！連日Twitterのトレンドを賑わせる、大人気動画配信エンタメユニット“すとぷり”待望の3rd FULL ALBUMが登場！テレビ東京系TVアニメ『妖怪学園Y 〜Nとの遭遇〜』オープニングテーマ「大宇宙ランデブー」やツイキャスキャンペーンソング「Streamer」のほか、「マブシガリヤ」「スキスキ星人」などを収録。 (C)RS／／特典〜DVD1枚、透明スリーブケース、トレーディングカード1枚付",4988031402825
【中古】 すとろべりーねくすとっ！（初回限定ライブ映像盤A）（DVD付）／すとぷり 【中古】afb,1089,https://item.rakuten.co.jp/bookoffonline/0019358955/,"すとぷり販売会社/発売会社：STPR,Records(STPR,Records)発売年月日：2020/01/15JAN：4988031368992／／特典〜DVD1枚付",4988031368992
すとぷり 2021 Spring オフィシャルグッズ すとぷり あにまるしりこんみらー すとろべりーぷりんす （莉犬）,3060,https://item.rakuten.co.jp/avanceonlinestore/4925415262254/,◆商品名：すとぷり 2021 Spring オフィシャルグッズ すとぷり あにまるしりこんみらー すとろべりーぷりんす （莉犬） すとぷり あにまるしりこんみらー（莉犬） 【サイズ】 W9.2cm×H10.2cm（約） 【素材】 シリコン、ガラス すとぷり あにまるしりこんみらー（莉犬） 【サイズ】 W9.2cm×H10.2cm（約） 【素材】 シリコン、ガラス,
